neighborhood,price,bedrooms,bathrooms,house size,description,neighborhood description
Willow Creek,500000,4,3,2500,"This charming colonial-style home features a wrap-around porch, hardwood floors, and a cozy fireplace. The backyard includes a deck and lush landscaping.","Willow Creek is a family-friendly neighborhood with top-rated schools, parks, and a variety of dining options nearby."
Sunset Hills,750000,5,4,3500,"This contemporary home offers an open floor plan, high-end finishes, and a chef's kitchen with quartz countertops. The backyard boasts a pool, spa, and outdoor living space.","Sunset Hills is known for its luxury homes and scenic views. Residents enjoy easy access to hiking trails, shopping centers, and fine dining restaurants."
Maple Grove,400000,3,2,2000,"This newly renovated ranch-style home features a spacious living room, updated kitchen, and a master suite with a walk-in closet. The backyard includes a patio and mature trees for privacy.","Maple Grove is a quiet neighborhood with tree-lined streets and friendly neighbors. It is conveniently located near schools, parks, and shopping centers."
River Oaks,1000000,6,5,4500,"This elegant Mediterranean villa offers a grand foyer, marble floors, and a gourmet kitchen with custom cabinetry. The backyard features a pool, spa, and outdoor fireplace.","River Oaks is an upscale neighborhood known for its luxury estates and exclusive country club. Residents enjoy a high standard of living and easy access to top-rated schools and fine dining restaurants."
Pinecrest Heights,600000,4,3,2800,"This traditional two-story home boasts a formal dining room, hardwood floors, and a sunroom overlooking the backyard. The outdoor space includes a patio and garden area.","Pinecrest Heights is a well-established neighborhood with mature trees and quiet streets. It is close to parks, schools, and shopping centers, making it ideal for families."
Oakwood Park,450000,3,2,2200,"This cozy bungalow features a brick fireplace, built-in bookshelves, and a renovated kitchen with stainless steel appliances. The backyard offers a deck and fenced yard.","Oakwood Park is a historic neighborhood with charming homes and a strong sense of community. Residents enjoy easy access to local shops, restaurants, and public transportation."
Cedar Ridge,800000,5,4,3200,"This modern farmhouse boasts an open concept layout, shiplap walls, and a chef's kitchen with a large island. The backyard includes a covered patio and fire pit.","Cedar Ridge is a trendy neighborhood with a mix of new construction and historic homes. It is close to trendy boutiques, cafes, and art galleries, making it popular among young professionals."
Lakeview Terrace,700000,4,3,3000,"This waterfront property offers panoramic lake views, a private dock, and a screened-in porch for outdoor dining. The interior features a stone fireplace, vaulted ceilings, and a gourmet kitchen.","Lakeview Terrace is a sought-after neighborhood for water enthusiasts and nature lovers. Residents enjoy boating, fishing, and hiking trails in the nearby park, as well as a strong sense of community."
Hillcrest Heights,550000,4,3,2600,"This mid-century modern home features an open floor plan, vaulted ceilings, and a wall of windows overlooking the backyard. The outdoor space includes a deck and mature landscaping.","Hillcrest Heights is a quiet neighborhood with tree-lined streets and friendly neighbors. It is close to schools, parks, and shopping centers, making it ideal for families."
Meadowbrook Estates,900000,5,4,3800,"This custom-built estate offers luxury finishes, a grand staircase, and a gourmet kitchen with top-of-the-line appliances. The backyard features a pool, spa, and outdoor kitchen.","Meadowbrook Estates is an exclusive neighborhood with large estate homes and private gated entrances. Residents enjoy a high standard of living and easy access to top-rated schools and country clubs."
Greenwood Village,650000,4,3,2700,"This contemporary home boasts a sleek design, high ceilings, and a chef's kitchen with quartz countertops. The backyard includes a covered patio and fire pit for outdoor entertaining.","Greenwood Village is a vibrant neighborhood with a mix of modern homes and historic properties. It is close to trendy restaurants, boutiques, and art galleries, making it popular among young professionals."
Sunnydale Heights,480000,3,2,2100,"This ranch-style home features a cozy living room, updated kitchen, and a master suite with a walk-in closet. The backyard offers a deck and fenced yard for outdoor relaxation.","Sunnydale Heights is a family-friendly neighborhood with tree-lined streets and a strong sense of community. It is close to parks, schools, and shopping centers, making it ideal for families."
Harbor Pointe,950000,6,5,4000,"This waterfront property offers stunning views of the harbor, a private dock, and a spacious deck for outdoor entertaining. The interior features a stone fireplace, hardwood floors, and a gourmet kitchen with a breakfast nook.","Harbor Pointe is a prestigious neighborhood for boating enthusiasts and nature lovers. Residents enjoy easy access to the marina, yacht club, and waterfront dining options, as well as a strong sense of community."
Whispering Pines,520000,4,3,2400,"This traditional two-story home boasts a formal dining room, hardwood floors, and a sunroom overlooking the backyard. The outdoor space includes a patio and garden area for outdoor relaxation.","Whispering Pines is a peaceful neighborhood with tree-lined streets and friendly neighbors. It is close to parks, schools, and shopping centers, making it ideal for families."
Golden Oaks,780000,5,4,3300,"This custom-built home offers luxury finishes, a grand staircase, and a gourmet kitchen with top-of-the-line appliances. The backyard features a pool, spa, and outdoor kitchen for outdoor entertaining.","Golden Oaks is an upscale neighborhood with large estate homes and private gated entrances. Residents enjoy a high standard of living and easy access to top-rated schools and country clubs."
Silverwood Heights,680000,4,3,2900,"This contemporary home boasts an open concept layout, high ceilings, and a chef's kitchen with quartz countertops. The backyard includes a covered patio and fire pit for outdoor entertaining.","Silverwood Heights is a trendy neighborhood with a mix of modern homes and historic properties. It is close to trendy restaurants, boutiques, and art galleries, making it popular among young professionals."
Mossy Oak Estates,520000,4,3,2400,"This charming cottage-style home features a cozy living room, updated kitchen, and a master suite with a walk-in closet. The backyard offers a deck and fenced yard for outdoor relaxation.","Mossy Oak Estates is a family-friendly neighborhood with tree-lined streets and a strong sense of community. It is close to parks, schools, and shopping centers, making it ideal for families."
Whitetail Ridge,720000,5,4,3100,"This modern farmhouse boasts an open concept layout, shiplap walls, and a chef's kitchen with a large island. The backyard includes a covered patio and fire pit for outdoor entertaining.","Whitetail Ridge is a trendy neighborhood with a mix of new construction and historic homes. It is close to trendy boutiques, cafes, and art galleries, making it popular among young professionals."
Cypress Pointe,580000,4,3,2500,"This coastal-inspired home offers a light-filled interior, hardwood floors, and a gourmet kitchen with a breakfast nook. The backyard features a deck and lush landscaping for outdoor relaxation.","Cypress Pointe is a waterfront neighborhood known for its scenic views and boating opportunities. Residents enjoy easy access to the marina, yacht club, and waterfront dining options, as well as a strong sense of community."
Stonebridge Estates,850000,5,4,3600,"This custom-built estate offers luxury finishes, a grand staircase, and a gourmet kitchen with top-of-the-line appliances. The backyard features a pool, spa, and outdoor kitchen for outdoor entertaining.","Stonebridge Estates is an exclusive neighborhood with large estate homes and private gated entrances. Residents enjoy a high standard of living and easy access to top-rated schools and country clubs."
Oakwood Hills,500000,4,3,2600,"This traditional two-story home boasts a formal dining room, hardwood floors, and a sunroom overlooking the backyard. The outdoor space includes a patio and garden area for outdoor relaxation.","Oakwood Hills is a peaceful neighborhood with tree-lined streets and friendly neighbors. It is close to parks, schools, and shopping centers, making it ideal for families."
Riverbend Estates,920000,6,5,4200,"This waterfront property offers stunning views of the river, a private dock, and a spacious deck for outdoor entertaining. The interior features a stone fireplace, hardwood floors, and a gourmet kitchen with a breakfast nook.","Riverbend Estates is a prestigious neighborhood for boating enthusiasts and nature lovers. Residents enjoy easy access to the marina, yacht club, and waterfront dining options, as well as a strong sense of community."
Hilltop Manor,540000,4,3,2700,"This cozy bungalow features a brick fireplace, built-in bookshelves, and a renovated kitchen with stainless steel appliances. The backyard offers a deck and fenced yard for outdoor relaxation.","Hilltop Manor is a historic neighborhood with charming homes and a strong sense of community. Residents enjoy easy access to local shops, restaurants, and public transportation."
Sycamore Grove,790000,5,4,3400,"This modern farmhouse boasts an open concept layout, shiplap walls, and a chef's kitchen with a large island. The backyard includes a covered patio and fire pit for outdoor entertaining.","Sycamore Grove is a trendy neighborhood with a mix of new construction and historic homes. It is close to trendy boutiques, cafes, and art galleries, making it popular among young professionals."
Lakeside Village,670000,4,3,3000,"This waterfront property offers panoramic lake views, a private dock, and a screened-in porch for outdoor dining. The interior features a stone fireplace, vaulted ceilings, and a gourmet kitchen.","Lakeside Village is a sought-after neighborhood for water enthusiasts and nature lovers. Residents enjoy boating, fishing, and hiking trails in the nearby park, as well as a strong sense of community."
Pinehurst Park,530000,4,3,2600,"This mid-century modern home features an open floor plan, vaulted ceilings, and a wall of windows overlooking the backyard. The outdoor space includes a deck and mature landscaping.","Pinehurst Park is a quiet neighborhood with tree-lined streets and friendly neighbors. It is close to schools, parks, and shopping centers, making it ideal for families."